Id	CharacterID	Pic	Title	Description	NextTrialID
110	1071004	Assets/Product/Texture/Image/UiFightTips/UiFightTipsJiaoxueR4Kalienina1.png	Space Walk	When Karenina: Scire is airborne, keep tapping Basic Attack to cast Radiant Whirlwind, dealing Dark DMG and increasing airborne time and spin speed.	111
111	1071004	Assets/Product/Texture/Image/UiFightTips/UiFightTipsJiaoxueR4Kalienina1.png	Space Walk	Upon landing, triggers Gravity Overload, dealing Dark DMG, reducing Anti-gravity Energy, and gaining Energy.	112
112	1071004	Assets/Product/Texture/Image/UiFightTips/UiFightTipsJiaoxueR4Kalienina1.png	Space Walk	If Karenina: Scire has no less than 20 Anti-gravity Energy, she can jump up again until her Anti-gravity Energy drops below 20.	113
113	1071004	Assets/Product/Texture/Image/UiFightTips/UiFightTipsJiaoxueR4Kalienina1.png	Space Walk	When in the Anti-gravity status, dodges to cast Airborne Spin, pulling and knocking back enemies around her, dealing Dark DMG, and restoring 20 Anti-gravity Energy. (This effect can only be triggered once every 10s.)	114
114	1071004	Assets/Product/Texture/Image/UiFightTips/UiFightTipsJiaoxueR4Kalienina1.png	Space Walk	When Matrix is triggered by dodging, casts Returning Repulsion, pulling and knocking back enemies around her, dealing Dark DMG, and restoring 40 Anti-gravity Energy.	115
115	1071004	Assets/Product/Texture/Image/UiFightTips/UiFightTipsJiaoxueR4Kalienina1.png	Space Walk	Radiant Whirlwind grants Kinetic Energy. When in the Anti-gravity status, casts Starshatter Horizon and the Signature Move will deal more damage based on Kinetic Energy accumulated.	107
116	1571003	Assets/Product/Texture/Image/UiFightTips/UiFightTipsJiaoxueR2Nuoan01.png	Rising Key	After Arca casts any 3-Ping, stop tapping Basic Attack or keep tapping it for a period of time to trigger a Combo Strike.	117
117	1571003	Assets/Product/Texture/Image/UiFightTips/UiFightTipsJiaoxueR2Nuoan01.png	Rising Key	After a 3-Ping, tap Basic Attack to charge Rising Energy. Casting Gear-Break Combo will consume the energy charged to deal extra DMG.	118
118	1571003	Assets/Product/Texture/Image/UiFightTips/UiFightTipsJiaoxueR2Nuoan01.png	Rising Key	If Gear Level is lower than 3, the Rising Energy consumed will be converted into Rotational Speed.	119
119	1571003	Assets/Product/Texture/Image/UiFightTips/UiFightTipsJiaoxueR2Nuoan01.png	Rising Key	If Gear Level is lower than 3 and Rising Energy is greater than Rotational Speed when triggering a Combo Strike, Gear Level will go up by 1.	120
120	1571003	Assets/Product/Texture/Image/UiFightTips/UiFightTipsJiaoxueR2Nuoan01.png	Rising Key	At Gear Lv.3, triggering a Combo Strike will reset Gear Level and Rotational Speed to deal massive damage.	116
121	1041004	Assets/Product/Texture/Image/UiFightTips/UiFightTipsJiaoxueR4Bianka.png	Glowing Lanternlight	Press and hold Dodge to trigger Luminous Realm, during which Afterglow Orbs can be pinged alongside Signal Orbs of the same color.	122
122	1041004	Assets/Product/Texture/Image/UiFightTips/UiFightTipsJiaoxueR4Bianka.png	Glowing Lanternlight	Pinging orbs in Luminous Realm will accumulate Afterglow Points.	123
123	1041004	Assets/Product/Texture/Image/UiFightTips/UiFightTipsJiaoxueR4Bianka.png	Blade Abyss	After performing the Phase I Signature, Stigmata will enter Sword Form, during which no Signal Orbs will be generated.	124
124	1041004	Assets/Product/Texture/Image/UiFightTips/UiFightTipsJiaoxueR4Bianka.png	Blade Abyss	In Sword Form, after the 4th hit of Basic Attack or a successful dodge, pressing and holding Basic Attack triggers Sword Dance.	125
125	1041004	Assets/Product/Texture/Image/UiFightTips/UiFightTipsJiaoxueR4Bianka.png	Blade Abyss	In Sword Form, performing Signature when fully charged will unleash Illuminated Abyss.	121
126	1231002	Assets/Product/Texture/Image/UiFightTips/UiFightTipsJiaoxueR2Bangbinata.png	Strings On Me	Press and hold Basic Attack to consume Jete Points and enter the Strings On Me status to keep launching Basic Attacks.	129
127	1231002	Assets/Product/Texture/Image/UiFightTips/UiFightTipsJiaoxueR2Bangbinata.png	Solitary Dancer	In the Strings On Me status, take hit/release Basic Attack to make Bambinata jump up and enter the Solitary Dancer status.	126
128	1231002	Assets/Product/Texture/Image/UiFightTips/UiFightTipsJiaoxueR2Bangbinata.png	Pas De Chat	When in the Solitary Dancer status, uses Signal Orbs to cast Pas De Chat. Forgets the orbs of the same color upon a 3-Ping (will no long obtain the orbs of that color).	127
129	1231002	Assets/Product/Texture/Image/UiFightTips/UiFightTipsJiaoxueR2Bangbinata.png	Stringless Cage	Release to remember orbs of all colors	128