Id	Name	Type	Content	Quality	Announcer	MemberCount	NeedTime	RecommendAttrib[1]	RecommendAttrib[2]	RecommendAttrib[3]	RecommendAttrib[4]	PreQuestId[1]	PreQuestId[2]	Condition[1]	Condition[2]	FinishReward	ExtraReward	FilePoolId	IsRepeatedly
3033	Medical Assistance Request	3	An Oasis base has come under attack. Wounded refugees require evacuation and urgent treatment. Babylonia is requested to deploy Constructs with experience in rescue operations and piloting for assistance.	3	8	3	21600	3	4	5						8505	8533	80301	1
3034	Medical Assistance Request	3	A WGAA archaeological Team was trapped during an inspection mission on Earth, with several members reported wounded. Medical assistance is requested. Those with serious injuries have to be admitted to the Star of Life headquarters. Constructs skilled in piloting are, therefore, also recommended for assistance.	3	7	3	21600	3	4	6						8505	8534		1
3035	Combat Reinforcements Exercise	7	The F.O.S. Military Command College is planning to conduct a battlefield reinforcements exercise in the near future. This exercise will include march route planning, material transportation, medical support, and more. Combatants with relevant skills are requested to provide guidance.	3	13	3	21600	3	4	7						8505	8535	130701	1
4001	Antarctic Circle Abnormality Reconnaissance	2	Recently, frequent abnormalities have been detected under the sea ice in the Antarctic Circle. These are suspected to be associated with the atypical restlessness of the Hetero-Creatures. Constructs are requested to join an Arctic Route Union squad for a recon operation.	4	9	4	21600	1	2	3	5					8506	8537		1
4002	Combat Medical Request	3	A raid on City 126 has led to structural collapses with persons trapped within the debris. Combatants with recon skills are requested to assist with the medical and rescue operation.	4	7	4	21600	1	2	3	6					8506	8538		1
4003	Pursuit Defecting Constructs	1	A report has been received from a squad on Earth. They have located the hideout of the defecting Constructs, but several units were wounded during the pursuit. Reinforcements are requested.	4	2	4	21600	1	2	3	7					8506	8539	20101	1
4004	Routine Facility Maintenance	5	This season's routine maintenance of the facilities in a conservation area is falling behind schedule. The Engineering Force is requested to deploy Constructs for assistance. As the conservation area is located in complicated terrain, possessing combat abilities is also highly recommended.	4	3	4	21600	1	2	4	5					8506	8540	30502	1
4005	The Kowloong Ruins Expedition	6	A scientific research team from Kowloong encountered a number of Corrupted while exploring a ruins site at the border. Several members have been trapped in the ruins. Due to a lack of combatants in the team, Constructs proficient in combat and reconnaissance are requested to assist with the exploration work.	4	12	4	21600	1	2	4	6					8506	8541		1
4006	Military Exchanges	7	The Akdilek Commercial Alliance is currently planning a military exercise on Asslam. Babylonia has been invited to send Constructs with expertise in combat, reconnaissance, and piloting to attend the exercise.	4	10	4	21600	1	2	4	7					8506	8542	100701	1
4007	Excavate the Research Center Ruins	6	Now that the research center is secure, the subsequent excavation operation will commence to retrieve research samples and test data.\nConstructs are requested to escort the Science Council's investigators and assist with the excavation operation.	4	6	4	21600	1	2	5	6					8506	8537	60601	1
4008	Support Route Reconnaissance	2	To ensure a smoother support operation on Earth, the Support Force plans to establish a new support route. Constructs experienced in reconnaissance and engineering are requested to provide assistance.	4	4	4	21600	1	2	5	7					8506	8538	40201	1
4009	Protect Conservation Area	1	A conservation area to the west of City 051 has been raided by a substantial number of enemies. They are now advancing toward a Scavenger's campsite. In addition to that, this incursion has sparked a violent conflict between the Scavengers and the conservation area. Combatants with strong negotiation skills are requested to eliminate the Corrupted and mediate this conflict.	4	1	4	21600	1	2	6	7					8506	8539	10101	1
4010	Assist with Conservation Area Reconstruction	5	As the conservation area has been recovered, its reconstruction is set to commence shortly. Constructs are requested for assistance in this reconstruction project.	4	1	4	21600	1	3	5	6					8506	8540		1
4011	Urgent Reinforcements to the Conservation Area	3	The Corrupted have breached the defense line of a conservation area on Earth. Urgent reinforcements are requested.	4	1	4	21600	1	3	5	7					8506	8541	10301	1
4012	Eliminate All Threats in the Kowloong Ruins	1	A scientific research team from Kowloong is preparing to initiate an investigation into a newly discovered ruins site. Due to technical and personnel constraints, the Kowloong Corp has requested Babylonia to join forces in eliminating the threats inside. All data retrieved will be shared between the research institutes of both parties.	4	12	4	21600	1	3	6	7					8506	8542		1
4013	Urgent Treatment for Structural Collapses	4	SOS! A station along a goods transportation route to Akdilek has collapsed. Babylonia is requested to deploy Constructs for assistance in the transportation of goods and the reconstruction of the station.	4	4	4	21600	1	4	5	6					8506	8537		1
4014	Trade with Kowloong	4	The Arctic Route Union and Kowloong are going to exchange a batch of goods. Due to the exceptional distance between the two ports, the Arctic Route Union has requested Babylonia, with rewards offered, to deploy Constructs as escorts to ensure smooth sailing.	4	9	4	21600	1	4	5	7					8506	8538		1
4015	Goods Transshipment Notice	6	A research center on Earth has hit a bottleneck and requires a batch of devices for further investigation. As the transportation route traverses multiple dangerous regions, Babylonia is requested to deploy Constructs to escort the goods transportation.	4	6	4	21600	1	4	6	7					8506	8539		1
4016	Ruins Reconstruction	6	Recently, a new ruins site has been discovered in the Arctic Route Union region. Preliminary analysis indicates that it is possible to rebuild the ruins into a base.\nAs the reconstruction is planned to be conducted jointly by Babylonia and the Arctic Route Union, Constructs are requested to undertake missions in the designated region.	4	5	4	21600	1	5	6	7					8506	8540		1
4017	Reinforcements to Abnormal Conservation Area	3	Connection with a conservation area on Earth has been abruptly severed, and abnormal activities of the Hetero-Creatures have been identified around it. Constructs are requested to refortify the defense facilities in the conservation area and stand by for any urgent situations.	4	1	4	21600	2	3	5	6					8506	8541	10301	1
4018	Reinforcements to the Nighter	3	A horde of Corrupted has raided a pier where the Nighter was docked, resulting in heavy civilian casualties. Given the Nighter's lack of medical resources, Babylonia is requested to deploy Constructs for assistance in both the rescue operation and the subsequent reconstruction of the pier.	4	7	4	21600	2	3	5	7					8506	8542		1
4019	Pursuit Defecting Constructs	2	Note: Reports indicate that the defecting Constructs have invaded a conservation area, posting a threat to the civilians inside. Scout- and support-type Constructs are requested for assistance in tracking down the defecting Constructs and protecting the civilians.	4	2	4	21600	2	3	6	7					8506	8537	20201	1
4020	Ruins Refortification Project	6	The WGAA has discovered a ruins site on Earth. Preliminary investigation reveals that it is of significant human cultural value. However, its fragile structure is at risk of imminent collapse.\nAfter acquiring enough materials, the WGAA has requested the deployment of Constructs for assistance in transporting the materials for the refortification project.	4	5	4	21600	2	4	5	6					8506	8538		1
4021	Base Reconstruction Assistance	7	With the activities of the Corrupted at the Arctic Route Union border subsiding, it is an opportunity to rebuild the damaged bases in that region. Babylonia is requested to deploy specialists with relevant expertise to provide technical guidance for the reconstruction.	4	9	4	21600	2	4	5	7					8506	8539		1
4022	Sample Collection and Transportation	4	For some of the Science Council's projects to proceed to the next phase, they require samples collected from hazardous regions on Earth. Constructs proficient in reconnaissance and piloting are requested to provide assistance for this task.	4	6	4	21600	2	4	6	7					8506	8540		1
4023	Underground Ruins Investigation	2	A new underground ruins site has been discovered near a recently built station, but the investigation has hardly made progress due to the site's complicated terrain. To explore its internal structure, Babylonia is requested to deploy Constructs for assistance. The investigation results will be shared mutually.	4	10	4	21600	2	5	6	7					8506	8541		1
4024	Negotiation With Scavengers	7	A group of Scavengers, who had initially claimed that they only intended to collect materials, turned out to have damaged a conservation area's defense facilities, stolen its materials, and even wounded several of its officers. Constructs are requested to defuse the conflicts and assist with repairing the damaged defense facilities.	4	3	4	21600	3	5	6	7					8506	8542		1
4025	Base Facility Upgrade	5	Because of the vulnerability of its defense facilities, the Oasis has sustained significant losses from attacks by the Corrupted. It has requested Babylonia to deploy Constructs for assistance in refortifying its defenses. In return, the Forsaken will support Babylonia's future goods transportation and exchange.	4	8	4	21600	4	5	6	7					8506	8540	80501	1
4026	Protect Oasis Base	1	An Oasis base has come under attack by a large number of Corrupted. Its defenses are already on the brink of collapse. Immediate assistance is required to evacuate the refugees and rescue the injured.	4	8	4	21600	1	2	3	4					8506	8537	80101	1
4027	Casualty Evacuation Request	4	The casualties in an Oasis base have exceeded its capacity. The Oasis is planning to send the lightly injured to another base and has requested assistance in transportation.	4	8	4	21600	1	3	4	5					8506	8538	80401	1
4028	Combat Reinforcements Request	3	A patrolling squad was ambushed in the Antarctic Circle. With their vehicles damaged and no specialists in rescue and combat at the nearby campsites, they are now unable to return to their base. Babylonia is requested to deploy Constructs for assistance.	4	9	4	21600	1	3	4	6					8506	8539		1
4029	Eliminate the Corrupted	1	A train was ambushed by the Hetero-Creatures while traveling through a region with a high concentration of the Punishing Virus. During the ambush, a number of Corrupted managed to intrude into the train. Babylonia is requested to deploy combatants to eliminate the remaining Corrupted with Akdilek.	4	10	4	21600	1	3	4	7					8506	8540		1
4030	Structural Collapses at Construction Sites	5	Emergency: An earthquake has caused structural collapses with several casualties at construction sites in multiple conservation areas. Babylonia is requested to deploy Constructs for a rescue and reconstruction mission.	4	3	4	21600	2	3	4	5					8506	8541	30502	1
4031	Abnormal Conservation Area Investigation	2	Babylonia has detected abnormal activities in a conservation area on Earth. Unable to contact the conservation area, Babylonia has requested Constructs to investigate the situation and prepare for potential rescue and evacuation of civilians.	4	11	4	21600	2	3	4	6					8506	8542		1
4032	Negotiation Commission from the Nighter	7	A vessel carrying a batch of supplies for the Nighter has been forcibly hijacked by a group of thugs. As the vessel is far from where the Nighter is currently docked and close to Babylonia's conservation area, Babylonia is requested to deploy Constructs for assistance in negotiations to release the vessel.	4	11	4	21600	2	3	4	7					8506	8538		1
4033	Combat Medical Request	3	A battle on the defense line of a conservation area on Earth has successfully driven out the Hetero-Creatures, but the casualties were greater than expected. Medical assistance is requested for the transportation of the injured and the repair of damaged buildings.	4	7	4	21600	3	4	5	6					8506	8539		1
4034	Medical Supplies Transportation	4	A defense line on Earth is in the brink of collapse and direly needs medical supplies. The supplies are ready for transportation. Constructs are requested to provide assistance.	4	4	4	21600	3	4	5	7					8506	8540		1
4035	Medical Assistance	3	Due to the continuous shifting of quicksand, a number of Oasis bases have been destroyed, and numerous civilians have been trapped in a dangerous quicksand zone where casualties have already occurred. As the Forsaken lacks sufficient manpower to save all trapped civilians, Babylonia is requested to provide assistance in the rescue operations.	4	8	4	21600	3	4	6	7					8506	8541	80301	1
5001	>>>System Activation	1	Before Activating the Commission System—\nPlease note that this system, developed by Babylonia, will automatically issue missions that do not require a commandant's support to Constructs.\n>>>Please accept this commission to activate the system.	1	1	1	2	1								8501	8512	5001	0
5002	Help Me Reclassify Documents	7	Mr. Asimov told me to "find a person or two who understand what confidentiality is to help reclassify the documents about the special materials from the last experiment." It's certain that Mr. Asimov has remembered all the important data, but... but the normally confidential things should still be properly archived, right?\nMr. Asimov, am... am I doing this correctly?	2	6	2	18000	7				5001				8503	8524	5002	0
5003	Artworks Reclassification	7	While the artworks from Earth have been piling up in the WGAA's warehouse, most of our manpower is still concentrated on exploring new ruins on Earth.\nPlease send assistants used to handling confidential materials to help reclassify our artworks. After all, no one can guarantee that they don't hold any other secrets.\n—Allen	2	5	2	18000	7				5001		31001	31101	8503	8524	5003	0
5004	Please Bring Our Captain Back	5	...Always the first one arriving on the scene when it comes to repairing engines or demolishing abandoned buildings...\nPlease bring her back from the engine repair site and check on the broken engine. If we let her do it on her own... I don't want to see an explosion and become a piece of space debris with her.\n—Teddy	3	3	3	21600	5				5001		31002	31102	8505	8536		0
5005	Hey, Care to Lend a Hand?	4	This shipment of supplies needs to be delivered to the Forsaken, but the Supply Force is stretched, and the Forsaken does not have the people to collect it.\nWatanabe seems embarrassed to ask for Babylonia's help. That said, how can we turn away when what is left of humanity is in need of help?\nLet me issue this commission, and to the commandant willing to accept this, I really appreciate it.\n—Bridget	3	4	3	21600	4				5001		31002	31103	8505	8536		0
