Id	ChapterId	Name	IsBossNode	IsKeyNode	Type	TypeValue	Icon	PreShowId[1]	PreShowId[2]	PreShowId[3]	PreOpenId[1]	PreOpenId[2]	CostEndurance	RewardId	RewardIcon	CharacterIcon	TimeDesc	Posision[1]	Posision[2]	Title	Explain	EnterIco
1	1	M-1	0	1	2	TS00101BA							0			Assets/Product/Texture/Image/Role/RoleHeadGrayRaven.png	6:11			Unveiling the Golden Veil	Hidden in the darkness before Dawn, Gray Raven traveled through sandstorms and entered the unpopulated desert named "Golden Vortex".	Assets/Product/Texture/Image/UiExplore/UiExplorePlotTab01.png
2	1	M-2	0	0	1	30020101	Assets/Product/Texture/Image/UiExplore/UiExploreFubenNormal1.png	1					4	30020101	Assets/Product/Texture/Image/IconcurrencySp/IconConsumeMoneySp.png	Assets/Product/Texture/Image/Role/RoleHeadGrayRaven.png	6:22	1		First Conflict	After parting ways with Liv, Gray Raven and the guards of Golden Vortex had conflict for the first time.<color=#0e70bd>\nTeam BP Limit: 3000             Required units: 1</color>	Assets/Product/Texture/Image/UiExplore/UiExploreBattleTab01.png
3	1	M-3	0	0	2	TS00102BA		2					0			Assets/Product/Texture/Image/Role/RoleHeadGrayRaven.png	6:36			Mystery of the Light Pillar	In the center of Golden Vortex was a group of buildings shrouded in the "Golden Pillar". Its origin was still unknown to Gray Raven.	Assets/Product/Texture/Image/UiExplore/UiExplorePlotTab01.png
4	1	M-4	0	0	1	30020102	Assets/Product/Texture/Image/UiExplore/UiExploreFubenNormal1.png	3					4	30020102	Assets/Product/Texture/Image/IconcurrencySp/IconConsumeSPSp.png	Assets/Product/Texture/Image/Role/RoleHeadGrayRaven.png	6:47	1		Mystery of the Light Pillar	30 minutes after Liv left, Lucia found the remains of Goldfinch members. She swore that she would find out the murderer.<color=#0e70bd>\nTeam BP Limit: 3000             Required units: 1</color>	Assets/Product/Texture/Image/UiExplore/UiExploreBattleTab01.png
5	1	B II-1	0	0	2	TS00103BA		4					0			Assets/Product/Texture/Image/Role/RoleHeadSandSparrow.png	Yesterday 12:45			Value of Existence	Yesterday at noon time, Goldfinch changed their mission objective and started heading toward the center of Golden Vortex.	Assets/Product/Texture/Image/UiExplore/UiExplorePlotTab01.png
6	1	B II-2	0	0	1	30020103	Assets/Product/Texture/Image/UiExplore/UiExploreFubenNormal1.png	5					4	30020103	Assets/Product/Texture/Image/IconToolsSp/ItExpI010030Sp.png	Assets/Product/Texture/Image/Role/RoleHeadSandSparrow.png	Yesterday 15:55	1		Stumble	It took Goldfinch almost three hours before they finally arrived at the outer walls of the central area...<color=#0e70bd>\nTeam BP Limit: 3000             Required units: 1</color>	Assets/Product/Texture/Image/UiExplore/UiExploreBattleTab01.png
7	1	B II-3	0	0	1	30020104	Assets/Product/Texture/Image/UiExplore/UiExploreFubenNormal1.png	6					4	30020104	Assets/Product/Texture/Image/IconToolsSp/EGouliangI01001Sp.png	Assets/Product/Texture/Image/Role/RoleHeadSandSparrow.png	Yesterday 17:33	1		A Bridge Too Far	Goldfinch members were attacked and chased by the guards. By evening, they realized they no longer had the strength to move any further... <color=#0e70bd>\nTeam BP Limit: 3000             Required units: 1</color>	Assets/Product/Texture/Image/UiExplore/UiExploreBattleTab01.png
8	1	B II-4	0	0	2	TS00104BA		7					0			Assets/Product/Texture/Image/Role/RoleHeadSandSparrow.png	Yesterday 18:42			Contribution	As the night started to fall, Goldfinch members seemed to have foreseen their upcoming fate...	Assets/Product/Texture/Image/UiExplore/UiExplorePlotTab01.png
9	1	M-5	0	0	2	TS00105BA		4			7	21	0			Assets/Product/Texture/Image/Role/RoleHeadGrayRaven.png	6:58			Lone Raven	After the communication with Liv was cut, Lee left to search for her. Lucia stayed back with the commandant.	Assets/Product/Texture/Image/UiExplore/UiExplorePlotTab01.png
10	1	M-6	0	0	1	30020105	Assets/Product/Texture/Image/UiExplore/UiExploreFubenNormal1.png	9					4	30020105	Assets/Product/Texture/Image/IconcurrencySp/IconConsumeSPSp.png	Assets/Product/Texture/Image/Role/RoleHeadGrayRaven.png	7:15	1		Secret Passage	It had been an hour in Golden Vortex, and only Lucia and the commandant were left. They were forced to fall back to the underground secret passage.<color=#0e70bd>\nTeam BP Limit: 3000             Required units: 1</color>	Assets/Product/Texture/Image/UiExplore/UiExploreBattleTab01.png
11	1	M-7	0	0	1	30020106	Assets/Product/Texture/Image/UiExplore/UiExploreFubenNormal1.png	10					4	30020106	Assets/Product/Texture/Image/IconToolsSp/ItExpI010030Sp.png	Assets/Product/Texture/Image/Role/RoleHeadGrayRaven.png	7:30	1		The Queen and Hope	After hiding underground for 15 minutes... A Construct caught Lucia's attention. It was walking without purpose like a corpse.<color=#0e70bd>\nTeam BP Limit: 3000             Required units: 1</color>	Assets/Product/Texture/Image/UiExplore/UiExploreBattleTab01.png
12	1	M-8	0	0	2	TS00106BA		11					0			Assets/Product/Texture/Image/Role/RoleHeadGrayRaven.png	7:48			Royal Guards	The queen's royal guards chased after Lucia and the commandant. They had to run for almost an hour...	Assets/Product/Texture/Image/UiExplore/UiExplorePlotTab01.png
13	1	B III-1	0	0	2	TS00107BA		9					0			Assets/Product/Texture/Image/Role/RoleHeadLi3.png	7:07			Red Light, Green Light	Minutes after Lee left, he was trapped among a group of guards with peculiar behaviors...	Assets/Product/Texture/Image/UiExplore/UiExplorePlotTab01.png
14	1	B III-2	1	0	1	30020107	Assets/Product/Texture/Image/UiExplore/UiExploreFubenBoss1.png	13					4	30020107	Assets/Product/Texture/Image/IconToolsSp/E1GouliangMd010011Sp.png	Assets/Product/Texture/Image/Role/RoleHeadLi3.png	7:30	2		Battle in Alley	Lee struggled for half an hour trying to get rid of the guards. He moved to the secret passage, hoping the guards would be lost...<color=#0e70bd>\nTeam BP Limit: 3000             Required units: 2</color>	Assets/Product/Texture/Image/UiExplore/UiExploreBattleTab01.png
15	1	B III-3	0	0	2	TS00108BA		14					0			Assets/Product/Texture/Image/Role/RoleHeadLi3.png	7:42			Big Gamble	Lee fought a tough battle in the underground secret passage. The guards wanted to trap him to death...	Assets/Product/Texture/Image/UiExplore/UiExplorePlotTab01.png
16	1	M-9	0	0	2	TS00109BA		12	15		12	24	0			Assets/Product/Texture/Image/Role/RoleHeadGrayRaven.png	8:10			Letter of Invitation	When Lucia was trapped in a tough fight, the mysterious queen sent her royal guards to invite the commandant to her palace.	Assets/Product/Texture/Image/UiExplore/UiExplorePlotTab01.png
17	1	M-10	1	0	1	30020108	Assets/Product/Texture/Image/UiExplore/UiExploreFubenBoss1.png	16					4	30020108	Assets/Product/Texture/Image/IconcurrencySp/IconConsumeGemSp.png	Assets/Product/Texture/Image/Role/RoleHeadGrayRaven.png	8:20	2		Awakening	The invitation was in fact a subjugation. Lucia turned down the Queen's offer, so Gray Raven and the royal guards went to war.<color=#0e70bd>\nTeam BP Limit: 3000             Required units: 2</color>	Assets/Product/Texture/Image/UiExplore/UiExploreBattleTab01.png
18	1	M-11	0	1	2	TS00110BA		17					0			Assets/Product/Texture/Image/Role/RoleHeadGrayRaven.png	8:44			Queen's Arrival	It was nearly noon, the sun was hanging high in the sky and scorching the Golden Vortex. The "Golden Queen" finally revealed herself...	Assets/Product/Texture/Image/UiExplore/UiExplorePlotTab01.png
19	1	B I-1	0	0	1	30020109	Assets/Product/Texture/Image/UiExplore/UiExploreFubenNormal1.png	1					4	30020109	Assets/Product/Texture/Image/IconcurrencySp/IconConsumeMoneySp.png	Assets/Product/Texture/Image/Role/RoleHeadLifu3.png	6:41	1		Companion	Liv joined Browning, the leader of Goldfinch. They started searching for the tactical devices left behind by Goldfinch in the desert.<color=#0e70bd>\nTeam BP Limit: 3000             Required units: 1</color>	Assets/Product/Texture/Image/UiExplore/UiExploreBattleTab01.png
20	1	B I-2	0	0	2	TS00111BA		19					0			Assets/Product/Texture/Image/Role/RoleHeadLifu3.png	7:20			Digging Site	Browning finally found the device after searching in the desert for almost 40 minutes. But it was covered under some golden powder...	Assets/Product/Texture/Image/UiExplore/UiExplorePlotTab01.png
21	1	B I-3	0	0	1	30020110	Assets/Product/Texture/Image/UiExplore/UiExploreFubenNormal1.png	20					4	30020110	Assets/Product/Texture/Image/IconToolsSp/EGouliangI01001Sp.png	Assets/Product/Texture/Image/Role/RoleHeadLifu3.png	7:22	1		Protection	The device seemed to have attracted lots of guards. As they quickly came close, Liv swore to protect Browning...<color=#0e70bd>\nTeam BP Limit: 3000             Required units: 1</color>	Assets/Product/Texture/Image/UiExplore/UiExploreBattleTab01.png
22	1	B I-4	0	0	2	TS00112BA		21			9		0			Assets/Product/Texture/Image/Role/RoleHeadLifu3.png	7:40			Aftermath	After more than 10 minutes of digging, the device was almost out. But Browning triggered a landmine underneath it...	Assets/Product/Texture/Image/UiExplore/UiExplorePlotTab01.png
23	1	B I-5	0	0	1	30020111	Assets/Product/Texture/Image/UiExplore/UiExploreFubenNormal1.png	22					4	30020111	Assets/Product/Texture/Image/IconToolsSp/ItExpI190020Sp.png	Assets/Product/Texture/Image/Role/RoleHeadLifu3.png	7:41	1		Trojan Horse	To ensure the search mission could succeed, Liv decided to hack into the device's operating system...<color=#0e70bd>\nTeam BP Limit: 3000             Required units: 1</color>	Assets/Product/Texture/Image/UiExplore/UiExploreBattleTab01.png
24	1	B I-6	0	1	2	TS00113BA		23			12		0			Assets/Product/Texture/Image/Role/RoleHeadLifu3.png	7:46			Cheap Shot	Liv returned to her Construct after 5 minutes of hacking into the system. But Browning...	Assets/Product/Texture/Image/UiExplore/UiExplorePlotTab01.png
25	1	B I-7	0	1	2	TS00114BA		24			18		0			Assets/Product/Texture/Image/Role/RoleHeadLifu3.png	7:47			Explosive Encounter	Liv seized the opportunity for a "mutual destruction" with Browning...	Assets/Product/Texture/Image/UiExplore/UiExplorePlotTab01.png
51	2	M I-1	0	1	2	TS00115BA							0			Assets/Product/Texture/Image/Role/RoleHeadDubian3.png	9:08			Maverick	Watanabe reached the Golden Vortex in the morning. The enemy info was still unknown, but he charged in alone.	Assets/Product/Texture/Image/UiExplore/UiExplorePlotTab02.png
52	2	M I-2	0	0	1	30020201	Assets/Product/Texture/Image/UiExplore/UiExploreFubenNormal1.png	51					6	30020201	Assets/Product/Texture/Image/IconcurrencySp/IconConsumeMoneySp.png	Assets/Product/Texture/Image/Role/RoleHeadDubian3.png	9:15	1		Inquisition	Watanabe spent a few minutes observing the guards. He decided to capture one for inquisition.<color=#0e70bd>\nTeam BP Limit: 4000             Required units: 1</color>	Assets/Product/Texture/Image/UiExplore/UiExploreBattleTab02.png
53	2	M I-3	0	0	2	TS00116BA		52					0			Assets/Product/Texture/Image/Role/RoleHeadDubian3.png	9:21			Risk Transfer	10 minutes into the Golden Vortex, Watanabe met Bianca and decided to follow her.	Assets/Product/Texture/Image/UiExplore/UiExplorePlotTab02.png
54	2	M II-1	0	0	2	TS00117BA							0			Assets/Product/Texture/Image/Role/RoleHeadAolisuo3.png	8:25			Saving the Earth	After sending Liv away, Bianca searched in the sand for half an hour because she had figured out Babylonia's real intention...	Assets/Product/Texture/Image/UiExplore/UiExplorePlotTab02.png
55	2	M II-2	0	0	1	30020202	Assets/Product/Texture/Image/UiExplore/UiExploreFubenNormal1.png	54					6	30020202	Assets/Product/Texture/Image/IconcurrencySp/IconConsumeMoneySp.png	Assets/Product/Texture/Image/Role/RoleHeadAolisuo3.png	8:37	1		Back Alive	Bianca found survivors of Goldfinch unexpectedly while collecting samples... They were still alive!<color=#0e70bd>\nTeam BP Limit: 4000             Required units: 1</color>	Assets/Product/Texture/Image/UiExplore/UiExploreBattleTab02.png
56	2	M I-4	0	0	2	TS00118BA		53	55				0			Assets/Product/Texture/Image/Role/RoleHeadAolisuo3.png	9:32			Old Habit	It didn't take long before Watanabe was forced to reveal himself...	Assets/Product/Texture/Image/UiExplore/UiExplorePlotTab02.png
57	2	M I-5	1	0	1	30020203	Assets/Product/Texture/Image/UiExplore/UiExploreFubenBoss1.png	56					6	30020203	Assets/Product/Texture/Image/IconToolsSp/E1GouliangMd010011Sp.png	Assets/Product/Texture/Image/Role/RoleHeadAolisuo3.png	9:34	1		Clash	The negotiation didn't last long before Watanabe and Bianca escalated it into a violent event.<color=#0e70bd>\nTeam BP Limit: 4000             Required units: 1</color>	Assets/Product/Texture/Image/UiExplore/UiExploreBattleTab02.png
58	2	M I-6	0	0	2	TS00119BA		57					0			Assets/Product/Texture/Image/Role/RoleHeadDubian3.png	9:49			Choice	Watanabe's rescue plan faced challenge immediately after he got away from Bianca...	Assets/Product/Texture/Image/UiExplore/UiExplorePlotTab02.png
59	2	M I-7	0	0	1	30020204	Assets/Product/Texture/Image/UiExplore/UiExploreFubenNormal1.png	58					6	30020204	Assets/Product/Texture/Image/IconToolsSp/ItExpI010030Sp.png	Assets/Product/Texture/Image/Role/RoleHeadDubian3.png	10:00	1		Culprit of Sandstorm	Less than 1 hour into the Golden Vortex, Watanabe found the weather engine responsible for the sandstorm...<color=#0e70bd>\nTeam BP Limit: 4000             Required units: 1</color>	Assets/Product/Texture/Image/UiExplore/UiExploreBattleTab02.png
60	2	M I-8	0	0	2	TS00120BA		59					0			Assets/Product/Texture/Image/Role/RoleHeadDubian3.png	10:14			Relic	After leaving the weather engine, Watanabe found a pendant of the Forsaken from a guard...	Assets/Product/Texture/Image/UiExplore/UiExplorePlotTab02.png
61	2	M II-3	0	0	2	TS00121BA		57					0			Assets/Product/Texture/Image/Role/RoleHeadAolisuo3.png	9:39			Queen's Treat	Golden Queen revealed her true form to Gray Raven. Meanwhile, Bianca had explored Golden Vortex for hours, but the sample analysis still hadn't succeeded...	Assets/Product/Texture/Image/UiExplore/UiExplorePlotTab02.png
62	2	M II-4	0	0	1	30020205	Assets/Product/Texture/Image/UiExplore/UiExploreFubenNormal1.png	61					6	30020205	Assets/Product/Texture/Image/IconcurrencySp/IconConsumeSPSp.png	Assets/Product/Texture/Image/Role/RoleHeadAolisuo3.png	9:56	1		Tick-Tock	While waiting for the results of sample analysis, Bianca heard some strange noise. She followed the sound but ended up in a group of "Silent Guards"...<color=#0e70bd>\nTeam BP Limit: 4000             Required units: 1</color>	Assets/Product/Texture/Image/UiExplore/UiExploreBattleTab02.png
63	2	M I-12	0	0	2	TS00122BA		68			73		0			Assets/Product/Texture/Image/Role/RoleHeadAolisuo3.png	11:55			Queen's Request	Golden Queen announced her requests to the commandant and Babylonia in her palace.	Assets/Product/Texture/Image/UiExplore/UiExplorePlotTab02.png
64	2	M I-9	1	0	1	30020206	Assets/Product/Texture/Image/UiExplore/UiExploreFubenBoss1.png	60	71		60	71	6	30020206	Assets/Product/Texture/Image/IconToolsSp/ItFinalI020030Sp.png	Assets/Product/Texture/Image/Role/RoleHeadDubian3.png	10:22	2		Destiny	Watanabe met Bianca again, but refused to abandon any Forsaken. Violence became the last resort once again...<color=#0e70bd>\nTeam BP Limit: 4000             Required units: 2</color>	Assets/Product/Texture/Image/UiExplore/UiExploreBattleTab02.png
65	2	M I-10	0	0	2	TS00123BA		64					0			Assets/Product/Texture/Image/Role/RoleHeadDubian3.png	10:32			Promise	Watanabe and Bianca fought for almost 10 minutes, but neither was going to win. The guards took the opportunity and laid siege on them...	Assets/Product/Texture/Image/UiExplore/UiExplorePlotTab02.png
66	2	B-1	0	0	2	TS00124BA		57					0			Assets/Product/Texture/Image/Role/RoleHeadShenwei3.png	9:51			Off Form	Kamui and Roland fought all the way to the northwest of Golden Vortex, when Kamui discovered some anomaly in Roland's Construct...	Assets/Product/Texture/Image/UiExplore/UiExplorePlotTab02.png
67	2	B-2	0	0	1	30020207	Assets/Product/Texture/Image/UiExplore/UiExploreFubenNormal1.png	66			64		6	30020207	Assets/Product/Texture/Image/IconToolsSp/ItExpI010030Sp.png	Assets/Product/Texture/Image/Role/RoleHeadLuolan.png	10:24	1		Invincible	Kamui'd been fighting the Corrupted for almost half an hour. Roland managed to escape into the building... But Kamui wouldn't let him go!<color=#0e70bd>\nTeam BP Limit: 4000             Required units: 1</color>	Assets/Product/Texture/Image/UiExplore/UiExploreBattleTab02.png
68	2	M I-11	0	1	2	TS00125BA		65					0			Assets/Product/Texture/Image/Role/RoleHeadDubian3.png	11:30			Promise Keeper	It took Watanabe an hour to make sure all Forsaken had safely evacuated. Some tried to persuade him not to return and help Bianca...	Assets/Product/Texture/Image/UiExplore/UiExplorePlotTab02.png
69	2	M II-5	0	0	2	TS00126BA		62					0			Assets/Product/Texture/Image/Role/RoleHeadAolisuo3.png	10:10			Hostage	After defeating the "Silent Guards", Bianca followed the strange noise into a secret chamber with humans locked up in it...	Assets/Product/Texture/Image/UiExplore/UiExplorePlotTab02.png
70	2	M II-6	0	0	1	30020208	Assets/Product/Texture/Image/UiExplore/UiExploreFubenNormal1.png	69					6	30020208	Assets/Product/Texture/Image/IconcurrencySp/IconConsumeSPSp.png	Assets/Product/Texture/Image/Role/RoleHeadAolisuo3.png	10:13	1		Unexpected Assistance	Bianca considered the pros and cons for a brief moment, then decided to rescue the hostage.<color=#0e70bd>\nTeam BP Limit: 4000             Required units: 1</color>	Assets/Product/Texture/Image/UiExplore/UiExploreBattleTab02.png
71	2	M II-7	0	0	2	TS00127BA		70					0			Assets/Product/Texture/Image/Role/RoleHeadAolisuo3.png	10:19			Two Ways of Rescue	Bianca defeated the warden and freed all the hostage. Bianca stopped her as he wanted to take his own men.	Assets/Product/Texture/Image/UiExplore/UiExplorePlotTab02.png
72	2	M II-8	0	0	2	TS00128BA		65			74		0			Assets/Product/Texture/Image/Role/RoleHeadAolisuo3.png	11:04			Golden Antibody	Despite letting the hostage go, Bianca still took the Golden Antibody... But the royal guards suddenly attacked her!	Assets/Product/Texture/Image/UiExplore/UiExplorePlotTab02.png
73	2	M II-9	1	0	1	30020209	Assets/Product/Texture/Image/UiExplore/UiExploreFubenBoss1.png	72					6	30020209	Assets/Product/Texture/Image/IconcurrencySp/IconConsumeGemSp.png	Assets/Product/Texture/Image/Role/RoleHeadAolisuo3.png	12:00	2		Fatal Combo	At noon, Watanabe brought Forsaken to help Bianca... But the Queen's royal guards were pouring bullets!<color=#0e70bd>\nTeam BP Limit: 4000             Required units: 2</color>	Assets/Product/Texture/Image/UiExplore/UiExploreBattleTab02.png
74	2	B-3	0	1	2	TS00129BA		67			65		0			Assets/Product/Texture/Image/Role/RoleHeadLuolan.png	10:32			Negotiation	After confronting each other for many more minutes, Kamui almost made Roland devastated...	Assets/Product/Texture/Image/UiExplore/UiExplorePlotTab02.png
75	2	M I-13	0	1	2	TS00130BA		63	73				0			Assets/Product/Texture/Image/Role/RoleHeadAolisuo3.png	12:10			For Commandant	Bianca fought alongside the Forsaken to defeat the royal guards. Once again, she faced different choices...	Assets/Product/Texture/Image/UiExplore/UiExplorePlotTab02.png
101	3	M I-1	0	1	2	TS00131BA							0			Assets/Product/Texture/Image/Role/RoleHeadKalie3.png	12:15			Follower	Karenina sneaked into the Golden Vortex from the south. But she didn't know she was followed...	Assets/Product/Texture/Image/UiExplore/UiExplorePlotTab03.png
102	3	M l-2	0	0	1	30020302	Assets/Product/Texture/Image/UiExplore/UiExploreFubenNormal1.png	101					6	30020302	Assets/Product/Texture/Image/IconcurrencySp/IconConsumeSPSp.png	Assets/Product/Texture/Image/Role/RoleHeadKalie3.png	12:16	1		Shield of Protection	The guards had their eyes on Karenina the moment she stepped into the Golden Vortex.<color=#0e70bd>\nTeam BP Limit: 5000             Required units: 1</color>	Assets/Product/Texture/Image/UiExplore/UiExploreBattleTab03.png
103	3	M l-3	0	0	1	30020303	Assets/Product/Texture/Image/UiExplore/UiExploreFubenNormal1.png	102					6	30020303	Assets/Product/Texture/Image/IconToolsSp/ItExpI010030Sp.png	Assets/Product/Texture/Image/Role/RoleHeadKalie3.png	12:48	1		Toolbox	After thirty minutes of high-speed marching, Karenina finally got to demonstrate her strength...<color=#0e70bd>\nTeam BP Limit: 5000             Required units: 1</color>	Assets/Product/Texture/Image/UiExplore/UiExploreBattleTab03.png
104	3	M l-4	0	0	2	TS00132BA		103			118		0			Assets/Product/Texture/Image/Role/RoleHeadKalie3.png	12:53			Human Experiment	Nanami joined Karenina to defeat the guards of the main building together, but she disappeared within 5 minutes...	Assets/Product/Texture/Image/UiExplore/UiExplorePlotTab03.png
105	3	M l-5	0	0	1	30020305	Assets/Product/Texture/Image/UiExplore/UiExploreFubenNormal1.png	104					6	30020305	Assets/Product/Texture/Image/IconcurrencySp/IconConsumeSPSp.png	Assets/Product/Texture/Image/Role/RoleHeadKalie3.png	13:01	1		Restructure	Karenina received the analysis report of the antibody. She must re-establish the communication network to upload it...<color=#0e70bd>\nTeam BP Limit: 5000             Required units: 1</color>	Assets/Product/Texture/Image/UiExplore/UiExploreBattleTab03.png
106	3	M l-6	0	0	2	TS00133BA		105					0			Assets/Product/Texture/Image/Role/RoleHeadKalie3.png	13:15			Starting Again	The communication was restored for minutes and Karenina completed her mission with flying colors. It's up to her where she wants to go now.	Assets/Product/Texture/Image/UiExplore/UiExplorePlotTab03.png
107	3	M l-7	0	0	2	TS00134BA		106					0			Assets/Product/Texture/Image/Role/RoleHeadShenwei3.png	13:25			Resistance	Blasting through dozens of walls, Karenina decided to explore Golden Vortex in her own way...	Assets/Product/Texture/Image/UiExplore/UiExplorePlotTab03.png
108	3	M l-8	0	0	1	30020307	Assets/Product/Texture/Image/UiExplore/UiExploreFubenNormal1.png	107			115		6	30020307	Assets/Product/Texture/Image/IconToolsSp/ItExpI010030Sp.png	Assets/Product/Texture/Image/Role/RoleHeadShenwei3.png	13:33	1		Builder's Puzzle	After the walls were destroyed, the route became straight forward. It only took them minutes to break into the forbidden area.<color=#0e70bd>\nTeam BP Limit: 5000             Required units: 1</color>	Assets/Product/Texture/Image/UiExplore/UiExploreBattleTab03.png
109	3	M l-9	0	0	2	TS00135BA		122	108		107		0			Assets/Product/Texture/Image/Role/RoleHeadYongyechao3.png	13:41			Merge	Nanami returned, but she brought bad news about Roland the Ascendant...	Assets/Product/Texture/Image/UiExplore/UiExplorePlotTab03.png
110	3	M l-10	0	0	1	30020310	Assets/Product/Texture/Image/UiExplore/UiExploreFubenNormal1.png	109					6	30020310	Assets/Product/Texture/Image/IconToolsSp/EGouliangI01001Sp.png	Assets/Product/Texture/Image/Role/RoleHeadYongyechao3.png	13:43	1		Reverse Invasion	In order to find Roland's whereabouts, Nanami hacked into the guards' internal network. But Nithart saw it all...<color=#0e70bd>\nTeam BP Limit: 5000             Required units: 1</color>	Assets/Product/Texture/Image/UiExplore/UiExploreBattleTab03.png
111	3	M l-11	0	0	2	TS00136BA		110					0			Assets/Product/Texture/Image/Role/RoleHeadYongyechao3.png	13:50			Vision	Nanami's hacking only took a few minutes. She failed to trace Roland in the internal network, but she found out that Nithart took the commandant of Gray Raven...	Assets/Product/Texture/Image/UiExplore/UiExplorePlotTab03.png
112	3	M l-12	1	0	1	30020311	Assets/Product/Texture/Image/UiExplore/UiExploreFubenBoss1.png	111			125		6	30020311	Assets/Product/Texture/Image/IconcurrencySp/IconConsumeGemSp.png	Assets/Product/Texture/Image/Role/RoleHeadYongyechao3.png	14:05	1		Hidden Entrance	With the construction blueprint at hand, they managed to arrive at the entrance to the Queen's palace within an hour.<color=#0e70bd>\nTeam BP Limit: 5000             Required units: 1</color>	Assets/Product/Texture/Image/UiExplore/UiExploreBattleTab03.png
113	3	M l-13	0	0	2	TS00137BA		112					0			Assets/Product/Texture/Image/Role/RoleHeadYongyechao3.png	14:09			Tracking the Sound	After defeating golden guards and royal guards, they were only one door away from the commandant...	Assets/Product/Texture/Image/UiExplore/UiExplorePlotTab03.png
114	3	B ll-1	0	1	2	TS00138BA		104					0			Assets/Product/Texture/Image/Role/RoleHeadShenwei3.png	13:16			Deterrence	Under Roland's order, the Corrupted managed to stall Kamui for over 2 hours, only to make him fight even harder...	Assets/Product/Texture/Image/UiExplore/UiExplorePlotTab03.png
115	3	B ll-2	1	0	1	30020308	Assets/Product/Texture/Image/UiExplore/UiExploreFubenBoss1.png	114					6	30020308	Assets/Product/Texture/Image/IconToolsSp/ItExpI180020Sp.png	Assets/Product/Texture/Image/Role/RoleHeadShenwei3.png	13:20	2		Broken Sword	Kamui knew it very well: as long as the Elite Corrupted was defeated, he could go after Roland again.<color=#0e70bd>\nTeam BP Limit: 5000             Required units: 2</color>	Assets/Product/Texture/Image/UiExplore/UiExploreBattleTab03.png
116	3	M ll-1	0	1	2	TS00139BA							0			Assets/Product/Texture/Image/Role/RoleHeadLuolan.png	10:40			Hospitality	After getting rid of Kamui, Roland carefully assessed the threat of Golden Antibody...	Assets/Product/Texture/Image/UiExplore/UiExplorePlotTab03.png
117	3	M ll-2	0	0	1	30020301	Assets/Product/Texture/Image/UiExplore/UiExploreFubenNormal1.png	116					6	30020301	Assets/Product/Texture/Image/IconcurrencySp/IconConsumeMoneySp.png	Assets/Product/Texture/Image/Role/RoleHeadLuolan.png	10:43	1		Imprisoned	Roland stepped into Nithart's trap. Thanks to the antibody, the power of Punishing Virus was rapidly reduced.<color=#0e70bd>\nTeam BP Limit: 5000             Required units: 1</color>	Assets/Product/Texture/Image/UiExplore/UiExploreBattleTab03.png
118	3	M ll-3	0	0	2	TS00140BA		117					0			Assets/Product/Texture/Image/Role/RoleHeadLuolan.png	12:13			Seeking Help	Captured by Nithart, Roland was unfortunately covered in the antibody and suffered for 90 minutes...	Assets/Product/Texture/Image/UiExplore/UiExplorePlotTab03.png
